Record ID,Name,Type,Date,Timestamp,Text,Inferred Mode,Inferred Energy,Energy Shape,Contradiction,Snapshot,Loops,Next Action,Meta Flag,Is Summary?,Summary (AI),Actionable Insights (AI),Entry Length (Words),Days Since Entry,Is Recent?,Entry Sentiment (AI),Entry Theme Tags (AI)
recC3zHXMPN38sXiZ,Lost in Debugging Loops,Work,2026-01-01,2026-01-01T00:00:00.000Z,"Some stupid bugs and small naming convention errors can take up so much time! I just put one R because I didn't know which is the table name and which is the base ID in Airtable. You know, debugging software is something else.",Overthinking,Drained,Uneven,Action vs. Fear,"Frustrated by small errors during debugging, feeling stuck and mentally drained.",Ruminating on mistakes and minor details rather than moving forward.,"Take a short break, then re-approach the bug with a clear mind and a checklist of naming conventions.",Auto-Generated,False,"{""themes"": [""frustration with debugging"", ""mental fatigue"", ""attention to small details"", ""difficulty distinguishing between identifiers""]}",,43,0,Yes,Negative,"debugging, frustration, software development"
recVLRxF2Hn9dkcRW,Small Victory Celebration,Creativity,2026-01-01,2026-01-01T00:00:00.000Z,"My custom GPT worked, and I was able to send the record to Airtable. I became so happy that I clapped my hands and jumped a little bit in joy from my chair!",Hopeful,Elevated,Rising,Growth vs. Comfort,Felt a burst of joy and pride after successfully sending a record to Airtable with the custom GPT.,Reflecting on success and the joy of small wins.,Capture this momentum—note what worked well and plan your next experiment while energy is high.,Auto-Generated,False,"{""themes"": [""success after effort"", ""joy in problem-solving"", ""celebration of progress""]}","{""insights"": [""Celebrate small wins to reinforce motivation"", ""Use emotional highs to fuel creative focus"", ""Document learnings while enthusiasm is fresh""]}",33,0,Yes,Positive,"achievement, excitement, technology"
recfIy1ACKi1t8b6e,Pure Joy and Relief,Reflection,2026-01-01,2026-01-01T00:00:00.000Z,"Wow, this is insane! It did not even ask me for a confirmation, it just went by itself. I fucking love this! I'm so fucking happy! I'm going to have a bath and go and have my chai sutta.",Grounded,High,Expanding,Confidence vs. Doubt,"Overjoyed and relieved after witnessing seamless automation, planning to unwind with a relaxing chai-sutta moment.",Excitedly replaying the success and emotional high of the breakthrough.,Savor the calm after achievement—reflect on how effortless flow feels and how to recreate it next time.,Auto-Generated,False,"{""themes"": [""joy from automation"", ""emotional release"", ""celebration through simple pleasures""]}","{""insights"": [""Anchor the feeling of flow for future creative states"", ""Allow rest to consolidate success"", ""Integrate pleasure and gratitude into your workflow""]}",39,0,Yes,Positive,"excitement, spontaneity, happiness, relaxation"
recY19CPP0BG8Qj0J,Small Ritual Decisions,Routine,2026-01-01,2026-01-01T00:00:00.000Z,To bath or not to bath is the question. And then to do Shambhavi today or not is also another question.,Reflective,Low,Uneven,Action vs. Fear,Indecisive about small daily rituals like bathing and meditation.,Repetitive questioning around simple choices and routines.,Pick one small action—either bath or meditate—without overthinking.,Auto-Generated,False,"{""theme"":""Indecision about daily routine"",""emotion"":""Mild ambivalence"",""context"":""Reflecting on self-care actions""}","{""advice"":""Simplify choices; take one mindful action to build momentum and reduce hesitation.""}",21,0,Yes,Neutral,"decision-making, daily routine, self-care"
rec5C7esT1xgC7mZ3,Learning Joy in Solitude,Reflection,2026-01-01,2026-01-01T00:00:00.000Z,"Learning to live by myself, alone, single, facing a lot of challenges, but yeah I need to find joy by myself, and it is possible 100%. We are social beings, we are constructed like that, that's necessary as well. Just to be by myself and being happy is very important.",Hopeful,Balanced,Rising,Independence vs. Belonging,The user reflects on embracing solitude while acknowledging the human need for connection.,Revisiting the theme of independence and emotional self-sufficiency.,Create small daily rituals that bring personal joy and reinforce comfort in solitude.,Auto-Generated,False,"{""themes"": [""self-discovery"", ""solitude"", ""emotional independence"", ""acceptance of social nature""]}","{""advice"": [""Focus on self-nurturing routines."", ""Balance solitude with occasional meaningful social interactions."", ""Reflect on what joy truly means when alone.""]}",50,0,Yes,Positive,"independence, solitude, self-discovery, personal growth"
recuua1JnuhAAyHbr,Evening Smoke & Chai Joy,Routine,2026-01-01,2026-01-01T00:00:00.000Z,"Came for my smoke , hira ki chai kitni mast hai , love it",Calm,Balanced,Centered,Growth vs. Comfort,"Enjoying a peaceful moment with chai and a smoke, feeling grounded and content.",Reinforces the need for simple grounding rituals after daily routines.,Continue to create small moments of joy and mindfulness in everyday habits.,Auto-Generated,False,"{""themes"": [""comfort in routine"", ""sensory pleasure"", ""mindful relaxation""]}","{""insights"": [""Make mindful breaks part of your daily rhythm."", ""Recognize the grounding value of small pleasures like chai."", ""Use these pauses to reset your mind and body.""]}",14,0,Yes,,
reccOlCXBDytxx3QW,Beautiful Ride and Bike Love,Health,2026-01-01,2026-01-01T00:00:00.000Z,"I went for a bike ride. Had my Chai Sutta while going. I went like nice and normally had my chai sutta. Played some games and then while coming back, I had such a beautiful ride! I fell in love with my bike again. It's such a piece of beauty! I have a KTM C90. VOOM VOOM VOOM! FUCK WOW!",Hopeful,Elevated,Rising,Control vs. Surrender,"User enjoyed a rejuvenating bike ride and rediscovered love for their bike, feeling thrilled and alive.",Revisiting joy and attachment through familiar experiences like chai and biking.,Capture this sense of joy by planning more rides regularly to maintain emotional balance.,Auto-Generated,False,"{""themes"": [""joy"",""freedom"",""connection to self"",""motorcycling""], ""keywords"": [""bike ride"",""chai sutta"",""KTM C90"",""beautiful ride""]}","{""insights"": [""User feels deeply alive when engaging with movement and sensory rituals."",""Repetition of meaningful routines boosts emotional vitality.""], ""priority"": ""Maintain connection to these energizing rituals.""}",60,0,Yes,,
